test_metrics_per_run.tsv

run	threshold	TN	FP	FN	TP	precision	recall	accuracy	MCC	F1
1	6.568426328161174	1404	50	54	123	0.7109826589595376	0.6949152542372882	0.9362354383813611	0.6672027589926831	0.7028571428571428
2	5.690604653331956	1357	96	46	130	0.5752212389380531	0.7386363636363636	0.9128299570288521	0.6040057884749888	0.6467661691542289
3	5.963966599483024	1391	62	38	139	0.6915422885572139	0.7853107344632768	0.9386503067484663	0.7027225126621135	0.7354497354497355
4	6.575525034936055	1411	42	44	132	0.7586206896551724	0.75	0.947206875383671	0.7247280580254127	0.7542857142857143
5	6.445059897115922	1407	46	45	131	0.7401129943502824	0.7443181818181818	0.9441375076734193	0.7108882002905839	0.7422096317280453

README.md

## Final PSWM Model

$$\theta_{\text{final}} = \frac{6.568 + 5.691 + 5.964 + 6.576 + 6.445}{5} = \mathbf{6.2488}$$